,Unnamed: 0,Message,Narrative,Unnamed: 3,Unnamed: 4,Unnamed: 5,Unnamed: 6
356,,talk live gilli founder flat friend uk public page decis mastectomi without reconstruct wear prosthesi anyth youd like ask nurs addi,0,,,,
357,,fatigu common side effect breast cancer treatment mani peopl dont realis theyr experienc differ feel tire discov tip manag cancer relat fatigu becca app help adapt life beyond treatment https bccare org uk becca,0,,,,
358,,live answer question breast cancer clinic nurs specialist jane,0,,,,
359,,talk treatment side effect jane murphi clinic nurs specialist breast cancer care fiona someon like volunt pleas leav question comment thought comment section,0,,,,
360,,common experi pain joint take hormon therapi treat breast cancer especi drug like letrozol anastrozol exemestan put frequent ask question joint pain senior clinic nurs specialist rachel base question forum,0,,,,
361,,would like know coronavirus vaccin talk live consult oncologist sheeba irshad answer question,0,,,,
362,,almost half women uk check breast regular potenti sign breast cancer women never check breast new unusu chang accord recent survey vital women get habit regular breast check year round know what normal earlier breast cancer diagnos better chanc success treatment,0,,,,
363,,octob breast cancer awar month yesterday share near million women uk miss potenti lifesav nhs breast screen due covid urgent call govern nhs set demand imag diagnost met press play recruit train nhs staff deal delay backlog provid care support need most,0,,,,
364,,octob breast cancer awar month want talk breast screen import breast awar join clinic nurs specialist addi mitchel train volunt use servic heather got question leav comment well best answer mani can,0,,,,
365,,earlier breast cancer diagnos better chanc success treatment import check breast regular speak gp notic chang worri possibl symptom pleas wait report https breastcancernow org inform support got breast cancer sign symptom breast cancerutm sourc facebooko utm medium social utm campaign servic utm content tlcinfograph,0,,,,
366,,potenti blood test futur spot sign breast cancer return spread much earlier nhs clinic extrem excit need upcom trial identifi whether offer treatment patient stage could actual help interven improv chanc surviv qualiti life director research dr simon vincent,0,,,,
367,,near million women uk caught backlog wait breast screen caus grave concern know around women could live undetect breast cancer mammogram key tool earli detect breast cancer critic stop women die diseas understand breast screen programm paus necess due global covid pandem must press play ensur women access breast screen cannot afford programm paus baro delyth morgan chief execut breast cancer coronavirus biggest crisi breast cancer face decad start year number coronavirus case began grow becam clear quick pandem would huge impact breast cancer help us understand impact ask peopl breast cancer tell us coronavirus affect diagnosi treatment care report share hear see impact coronavirus breast cancer includ breast cancer patient healthcar profession https breastcancernow org us media press releas almost million women uk miss vital breast screen due covid utm sourc facebooko utm medium social utm campaign pr utm content prreport,0,,,,
368,,chanc win autumn wonder time explor cold crisp day favourit place escap hustl bustl comment chanc win pair skecher limit edit pink ribbon shoe winner pick random competit close th octob good luck,0,,,,
369,,last week lymphoedema awar week chat live manag way reduc risk clinic nurs specialist addi join tamsin sargeant talk histori lymphoedema breast cancer support shes receiv would like ask them,0,,,,
370,,live talk mental health breast cancer senior clinic nurs specialist rachel rawson zahida use someon like servic know care someon breast cancer physic treatment half stori let make mental health breast cancer prioriti,0,,,,
371,,live talk import breast awar asda tickl pink partnership breast cancer nurs addi join sophi coppafeel educ health communic director susan asda communiti champion diagnos breast cancer would like ask them,0,,,,
372,,weve talk exercis breast cancer liz oriordan answer question live instagram,0,,,,
373,,check breast take minut there special techniqu need train simpl tlc touch look check touch breast feel anyth unusu look chang anyth look differ check chang gp https breastcancernow org inform support got breast cancer sign symptom breast cancerutm sourc facebooko utm medium social utm campaign breastcheck,0,,,,
374,,talk live post surgeri lingeri prosthes marita woman zone question youd like ask marita nurs addi,0,,,,
375,,today first day breast cancer awar month want help us spread word peopl know check sign symptom breast cancer pleas share imag help us reach peopl ever befor,0,,,,
376,,today day put uniti band share photo today play part support affect cancer today adaytounit,0,,,,
377,,nurs catherin answer question secondari breast cancer,0,,,,
378,,work hard breast cancer understand impact coronavirus peopl affect breast cancer contact health servic uk profession bodi other want make sure hear direct peopl affect breast cancer impact might highlight experi relev health bodi necessari alert emerg issu face patient would grate anyon want share experi concern impact covid breast cancer treatment servic exampl possibl chang appoint propos treatment let us know complet short survey www surveymonkey co uk r coronavirusimpact https www surveymonkey co uk r coronavirusimpact anyon specif question treatment call free helplin speak expert nurs,0,,,,
379,,check breast take minut earlier breast cancer diagnos better chanc success treatment import check breast regular see gp notic chang here quick guid look check breast http bit ly mj aa,0,,,,
380,,follow cancer survivorship day june well discuss finish treatment look way manag physic mental side effect breast cancer treatment clinic nurs specialist rachel rawson chat author entrepreneur leann pero pleas think question might want ask them,0,,,,
381,,sinc coronavirus hit news weve lot call question peopl whove breast cancer worri risk clinic nurs specialist jane answer common question breast cancer coronavirus,0,,,,
382,,dedic volunt amaz asda communiti champion generous asda custom thank support bucket collect asda store incred,0,,,,
383,,march breast screen servic suspend due coronavirus covid outbreak breast screen restart uk although take longer resum area other mani screen unit send invit juli here need know restart breast screen uk,0,,,,
384,,diagnosi breast cancer chang life forev breast cancer care vital care support inform day need help us keep support free get world cancer day uniti band today http worldcancerday breastcancercar org uk,0,,,,
385,,sever year concern breast imag diagnost workforc overstretch sever pressur increas demand breast servic age popul worsen persist shortag workforc coronavirus caus serious disrupt screen servic signific backlog develop servic suspend peak pandem warn near million women uk miss nhs breast screen due covid find more,0,,,,
386,,weve talk diet breast cancer put question breast cancer nurs rachel dietitian adel hug live instagram,0,,,,
387,,togeth cancer voic group cancer chariti weve develop advic coronavirus peopl cancer peopl cancer famili friend peopl cancer advic updat inform becom avail,0,,,,
388,,throughout breast cancer awar month select skecher sold go toward vital breast cancer research care celebr launch partnership skecher give chanc win skecher voucher enter simpli tell us would like surpris friend gift voucher pick lucki winner random tuesday octob see term condit below,0,,,,
389,,live discuss tip cope diagnosi treatment festiv period clinic nurs specialist rachel rawson jane murphi,0,,,,
390,,chat live hair loss scalp hair care breast cancer treatment clinic nurs specialist rachel join jasmin julia gupta cancer hair care got question either pleas leav comment below,0,,,,
391,,back sun get check campaign breast awar rita ora play import role rais awar regular breast check know bodi better check regular new unusu breast chang chang breast cancer know sooner diagnos like treatment success find look https breastcancernow org howto https breastcancernow org inform support got breast cancer sign symptom breast cancer,0,,,,
392,,model applic show london open ever want strut stuff famous catwalk last year celebr courag model step style onto catwalk follow breast cancer diagnosi year could applic close march appli http bit ly bl q https breastcancernow org get involv social event show london model applicationsutm sourc facebooko utm medium social utm campaign theshow utm content modelrecruitmentfacebook,0,,,,
393,,talk live support uncertain time senior clinic nurs specialist rachel answer question youv ask us recent anyth youd like ask her,0,,,,
394,,everyon ran walk cycl got dress bake organis raffl much breast cancer awar month thank everyth press play vital breast cancer research care none would possibl without support invalu input determin ever make sure everyon diagnos breast cancer live support live well,0,,,,
395,,ductal carcinoma situ dcis non invas form breast cancer thought half dcis case turn invas breast cancer left untreat difficult predict one becom invas one need find better way tell apart everyon receiv time appropri treatment dr richard grose investig molecular chang dcis growth abl use cell tissu bank creat model diseas studi lab read research project http bit ly jroxg inform tissu bank click http bit ly jclq,0,,,,
396,,went live talk sex intimaci breast cancer last week reveal women diagnos breast cancer say unhappi sex life diagnosi breast cancer care senior clinic nurs specialist rachel rawson join darlain honey person experi breast cancer effect bodi imag sex intimaci relationship talk sex intimaci breast cancer leav comment video view below,0,,,,
397,,breast cancer put lot pressur mental health know thing moment make even harder weve talk mental health breast cancer live leann pero black women rise instagram would like ask leann nurs rachel it,0,,,,
398,,talk live metastat spinal cord compress nurs catherin join sharon macmillan secondari breast cancer nurs specialist stephani mscc coordin royal stoke univers hospit would like ask them,0,,,,
399,,research fund breast cancer other led new blood test secondari metastat breast cancer could help track growth multipl tumour around bodi work well respond treatment blood test could use track secondari tumour chang time monitor respons rang treatment includ chemotherapi immunotherapi target therapi well radiotherapi studi breast cancer spread bodi vital go find way stop innov studi made possibl thank patient selfless donat help us gain insight breast cancer spread part bodi anoth pave way research stop secondari breast cancer dr simon vincent director research support influenc breast cancer now,0,,,,
400,,mum wife brother friend affect breast cancer tell us pink ribbon mean chanc win personalis pot elemi limit edit pro collagen marin cream comment winner select random pm juli notifi social media,0,,,,
401,,nurs jane chat juliet volunt someon like servic breast cancer experi call helplin,0,,,,
402,,weve talk go breast cancer young children instagram watch senior clinic nurs specialist rachel talk kirsti experi answer question,0,,,,
403,,there good thing come pinktob get men women men get breast cancer age becom breast awar breast cancer surgeon blogger liz riordan explain get behind big pink octob late get involv big small grab download free fundrais kit help share messag breastcancerawarenessmonth https www breastcancercar org uk big pink,0,,,,
404,,readi step challeng sign walk run step day month august take new challeng rais vital fund breast cancer research help chang live everi step take,0,,,,
405,,call men join real men australia wear pink support life chang breast cancer research whether solo superhero take challeng team work make real differ affect breast cancer realmenwearpink bit ly realmenwearpink http realmenwearpink org au utm sourc facebook utm medium social utm campaign rmwp utm content ie im imagevid,0,,,,
406,,go pink june stop breast cancer take peopl love youll get free host kit resourc materi need go pink click learn more,0,,,,
407,,wed like introduc new partner nutura nutura aim rais nbcf fund life chang breast cancer research thank support nutura,0,,,,
408,,mani women give take life save hormon treatment breast cancer recommend year time frame most due side effect life save treatment substanti reduc risk breast cancer return nbcf cancer australia co fund recent studi import find whether women engag doctor right point consid way manag side effect stop medic read studi find http bit ly f tonm,0,,,,
409,,sadden hear pass natasha stuart breast cancer thought natasha famili time advoc breast cancer awar share journey help creat chang https www smh com au cultur music voic contest natasha stuart die cancer p vu html,1,,,,
410,,free test famili breast cancer avail novemb,0,,,,
411,,largest studi chemo brain patient report abil think rememb learn new thing impair long atfer treatment breast cancer stop,0,,,,
412,,australian diagnos breast cancer everi day regist today squat challeng help us chang stat breast cancer stop neither learn bit ly squatchalleng https fundrais nbcf org au event squat challeng homeutm sourc facebook utm medium cpc utm campaign nbcf sc elev ad,0,,,,
413,,look futur death breast cancer join us yearchalleng zerobi,0,,,,
414,,would like acknowledg conni johnson love sister commit breast cancer research thought famili friend time,1,,,,
415,,break news new drug nerlynx approv treat posit breast cancer australia https www news com au breast cancer drug approv australia researchnew breastcanc,0,,,,
416,,june peopl countri particip go pink pledg wear shave colour game chang breast cancer research shave head bright pink hair powder pink outfit rais vital awar help support research detect tumour earlier improv outcom ultim save live want say huge thank everi singl person thank make huge differ futur breast cancer gopink mypinkpledg zerobi,0,,,,
417,,go pink start today tell excit hashtag content gopink see look pretti pink cannot wait see sea pink feed still want regist late regist https fundrais nbcf org au event go pink,0,,,,
418,,research studi cancer vaccin decad aim use vaccin teach bodi immun system fight cancer research us trial vaccin hope prevent tumour recur peopl alreadi cancer http bit ly v negq http nbcf org au news research news research show promis breast cancer vaccin utm content articl bcvaccin utm medium social utm term articl cmarcomm cresearch utm sourc facebook research,0,,,,
419,,tag someon would trek great wall https inspiredadventur com au event nbcf china,0,,,,
420,,th june year old week pregnant mel world turn upsid diagnos breast cancer mel inspir us everi day whilst go chemotherapi treatment week pregnant join step breast cancer achiev step day rais fund research join us thank mel real life hero zerobi,1,,,,
421,,us research outsid box think develop new way kill hard reach tumour research news,0,,,,
422,,today excit announc launch new brand look logo mark dawn new era nbcf sinc start nbcf invest million australian research project thank peopl like togeth seen new drug better treatment improv surviv rate get start week kick th anniversari celebr futur goal firm sight perfect time take look ambit next level come week start see new look roll social page websit email look sound littl differ rest assur us still organis goal stop death breast cancer side wait get detail visit nbcf org au zerobi,0,,,,
423,,time year ago sinead face tell children breast cancer told mummi sick breast cancer serious go okay extrem emot face breast cancer diagnosi exact month christma alway special sentiment time face peopl love tell breast cancer seem right make donat festiv season help support famili like sinead affect breast cancer donat today http nbcf org au christmasapp utm sourc facebook utm medium social utm content sinead utm campaign xmas,1,,,,
424,,regist triathlon pink event australia fit level challeng sign today support life chang breast cancer research,0,,,,
425,,today intern women day mani wonder amaz women make world great celebr social econom cultur polit achiev women let awar progress slow mani place world urgent action need acceler gender pariti iwd pledgeforpar amazingwomen womensday,0,,,,
426,,attent changemak go pink june rais fund research your help us move closer ultim goal death breast cancer go pink zerobi go pink,0,,,,
427,,challeng go pink june support australian live breast cancer learn https fundrais nbcf org au go pink https fundrais nbcf org au event go pinkutm sourc facebook utm medium social utm campaign go pink recruit post,0,,,,
428,,tag mate wear pink june go get involv realmenwearpink make differ live women men diagnos breast cancer head bit ly skdhav tagam rmwp,0,,,,
429,,signific drop number mammogram carri breastscreen australia due covid accord australian institut health welfar mammogram perform australia march drop dramat april due breast screen pleas ensur make appoint follow covid safeti protocol earli detect breast cancer give best possibl chanc surviv earlier abnorm discov greater number effect treatment option avail ensur best possibl outcom zerobi breastscreen,0,,,,
430,,octob nation breast cancer awar month give everyon opportun focus breast cancer impact affect diseas communiti nbcf number way take part make differ breast cancer awar month click find more,0,,,,
431,,tough friend first time saw diagnosi cri honest said sorri know say know everybodi bless peopl live see light darkest situat donat today help mani australian famili feel less afraid breast cancer diagnosi put stop death diseas rene diagnos donat today nbcf org au donat http nbcf org au donat,1,,,,
432,,sara diagnos breast cancer age young children think old enough breast cancer watch stori see hope keep sara go tough day zerobi,1,,,,
433,,vision world without breast cancer know done mark wife anni diagnos breast cancer confirm secondari cancer gave work becom full time carer sad anni pass away sinc mark daughter laura continu support breast cancer research nbcf realmenwearpink campaign mark explain anni said thing stand breast cancer cure fund dollar absolut believ right realli want anyon go journey laura still thank amaz support mark continu shine light forgotten effect breast cancer find real men wear pink go http bit ly sqpe b,1,,,,
434,,come togeth friend famili colleagu rais fund life chang research host pink ribbon breakfast breakfast realli shouldnt skip get start today bit ly prb https pinkribbonbreakfast gofundrais com au utm sourc facebook utm medium social utm content ie vid utm campaign prb,0,,,,
435,,tag friend youd like trek great wall china flight accommod includ travel cost experi adventur lifetim make lifelong friend memori part stepstowardsresearch team regist http bit ly slqq t,0,,,,
436,,know metastat breast cancer stay dormant bodi year third women breast cancer go develop metastat breast cancer later life invest research aim ensur better time detect treatment metastaticawar http bit ly pxynec http nbcf org au nation breast cancer foundat breast cancer need know metastat breast cancer utm sourc facebook utm medium social utm term utm content ie utm campaign metbc,0,,,,
437,,much know metastat breast cancer known advanc secondari stage breast cancer challeng treat surviv rate women metastat breast cancer first diagnosi alarm low women still aliv year diagnosi http bit ly pqcyxr metastaticawar,0,,,,
438,,wake coronavirus pandem breastscreen centr around australia unfortun temporarili close stay home great time month breast self check continu fund research earli detect breast screen technolog share post challeng peopl bebreastawar checktheirpair whilst stay home handi checklist month breast check calendar help breast awar http ow ly ckcw z zil https nbcf org au news perform breast self exam zerobi covid coronavirus,0,,,,
439,,go pink june stop breast cancer take peopl love learn http bit ly go pink,0,,,,
440,,recurr breast cancer occur cancer cell escap initi treatment spread bloodstream somehow stay dormant wait right condit start multipli spread distant part bodi metastasis research investig dormanc could hold key prevent metastat breast cancer save live http bit ly grirlu http nbcf org au news research news research aim understand breast cancer return utm content articl recurr utm medium social utm term articl cmarcomm cresearch utm sourc facebook,0,,,,
441,,go pink june stop breast cancer take peopl love youll get free host kit resourc materi need go pink click learn more,0,,,,
442,,cancer never truli leav becom part stori endur raw fear threat understand mean power word truli inspir camillawithlov worldcancerday repost camillawithlov make repost beauti tribe today world cancer day know read affect horribl beast way anoth share pain deepest fear cri tear danc devil today want celebr everi warrior kick cancer ass come stronger resili ever want wrap arm around still suffer climb mountain unspeak terror shower love honour warrior longer us cancer never truli leav becom part stori endur raw fear threat understand mean never want precious littl girl famili suffer everi fibr promis scream bottom heart find cure year see battl ring fight fight head everyth got never give f cancer xxc celebrityapprenticeau nbcf nbcfaus,1,,,,
443,,lisa year old diagnos breast cancer time last year day christma mastectomi reconstruct take doctor advic opt freez egg prior start hormon therapi case want start famili futur fast forward year lisa understand cancer return thank research feel bless take noth grant help give gift time christma donat today https give nbcf org au donat zerobi notimelikethepres,1,,,,
444,,rene share stori first diagnosi breast cancer year journey diseas breast bone lung cancer invad year sinc initi diagnosi strong posit outlook life help thank rene stori provid hope inspir mani,1,,,,
445,,mother first friend best friend forev friend sign today women super mother day classic someth special mother day year head bit ly mdc mdc mothersday,0,,,,
446,,year countdown death breast cancer zerobi,0,,,,
447,,risk breast cancer cant chang like famili histori diseas risk research call modifi one chang better wors read http bit ly qdns b,0,,,,
448,,karen juli friend year gear take el camino nbcf love idea fund rais go sole research fill great hope comfort generat young women born centuri confront prospect surviv breast cancer say juli read interview karen juli find join path toward cure el camino,1,,,,
449,,sheila diagnos breast cancer mastectomi chemotherapi radiat sheila want share breast cancer journey help communiti understand breast cancer death sentenc hold high tea friend famili sheila rais game chang research help rais vital awar hero like sheila find today http nbcf org au fundrais zerobi notimelikethepres,1,,,,
450,,nation breast cancer foundat nutura wish announc joint agre end partnership never intent either organis cast doubt benefit breastfeed caus confus upset communiti breastfeed protect effect breast cancer organis endors breastfeed best option mother babi recognis need altern method feed due health reason agre mother seek advic doctor healthcar profession decid appropri approach feed child thank loyal communiti support us fund life chang breast cancer research best way possibl,0,,,,
451,,everi day women age diagnos breast cancer diseas ignor thank world class research fund tomorrow alreadi look differ diagnos zerobi fundthefutureforallwomen,0,,,,
452,,know alcohol healthi lot reason new research show need add anoth reason list http bit ly quojvk http nbcf org au news research news half glass wine day could increas risk breast cancer return utm sourc facebook utm medium social utm term utm content ie utm campaign research utm sourc facebook utm medium social utm term research utm content ie utm campaign research,0,,,,
453,,defi odd far grate everi day children dark difficult time past year discov alway beauti find even advers read rachel incred stori bit ly nbcf rachelsstori,1,,,,
454,,triathlon pink triathlon know swim pool ride push bike run jog walk finish line women fit level encourag take part rais fund life chang breast cancer research fun encourag environ regist http triathlonpink everydayhero do,0,,,,
455,,us heard chemo brain call cancer induc cognit impair frustrat deal nbcf co fund studi develop onlin program improv concentr memori visual skill women men improv qualiti life chemo,0,,,,
456,,new tablet target tumour seen light could benefit women dens breast tissu whose mammogram typic difficult read,0,,,,
457,,women posit breast cancer longer reli standard treatment hope work thank research herceptin discov specif prevent type breast cancer grow spread read research save live http bit ly sdbgmr,0,,,,
458,,thank welcom home absolut amaz step toward cure great wall trek team trekker flew back home weekend challeng day trek great wall china proud incred support peopl realli came togeth team share experi breast cancer help other need cheer addit rais life chang breast cancer research great exampl communiti spirit continu fund nbcf congratul team made youd like join team nbcf next adventur registr open inspir adventur path toward cure el camino info bit ly wtvhrq,0,,,,
459,,alex mum diagnos breast cancer year old cancer spread breast area bodi initi given life expect year brave fought anoth year pass away memori mum alex held mani fundrais nbcf recent year rais incred breast cancer research thank alex continu work toward mission death breast cancer join us thank alex leav comment zerobi,1,,,,
460,,receiv govern fund research way end death breast cancer donat vital brilliant research continu make life chang discoveri make tax deduct donat today http bit ly rskvxg,0,,,,
