,Unnamed: 0,Message,Narrative,Unnamed: 3,Unnamed: 4,Unnamed: 5,Unnamed: 6
232,,instant broke husband cri felt world complet shatter could think littl girl turn day diagnos wait year year activ fertil treatment includ round ivf want cancer take away id lost mother law long bowel cancer thought would happen maxin diagnos breast cancer https breastcancernow org us news person stori found breast cancer could think littl girlutm sourc facebooko utm medium social utm campaign servic utm content maxineblog,1,,,,
233,,seek help oncologist sever pain neck shoulder diagnos secondari breast cancer bone lung devast need immedi oper rebuild neck spinal cord compress chemotherapi radiotherapi regular treatment trastuzumab pertuzumab plus inject denosumab fortun treatment enabl get life woke pain left hand side went straight hospit told cancer spread brain natali,1,,,,
234,,allow sick cancer treatment tough take toll need prove anyon els superwoman find person stori like ann plus hint tip adjust life breast cancer treatment free becca app http bit ly ou tbd https breastcancernow org inform support support beccautm sourc facebooko utm medium social utm campaign becca utm content beccasundaypostfb,1,,,,
235,,could get head around fact mani peopl disappear life soon told cancer nurs explain peopl get scare selfish cope diseas remind anxieti aureli diagnos breast cancer friend stuck around support thank found someon talk to,1,,,,
236,,found breast cancer fall daughter flat quit funni time rememb say think pop boob day later check see bruis found quit larg lump initi react diagnosi disbelief incred hard task tell everyon husband best friend coupl colleagu knew lump take year work oncologist wouldnt let carri due risk infect obvious tear bit anger jealousi other carri normal live whole life becam treatment trip hospit get day go possibl win breast cancer question came wig shop mayb weird thought win cancer melani,1,,,,
237,,societi often associ feminin long flow lock grow number women choos celebr bald read women choos celebr bald like alic pictur lost hair due alopecia juliet whose hair fell side effect chemotherapi follow breast cancer diagnosi juliet said go bald felt empow wear wig feel right felt like pretenc like cover someth up,1,,,,
238,,way home work notic right breast rub seatbelt felt swollen mammogram earlier year clear surpris notic someth right went doctor straight away refer breast clinic june diagnos breast cancer told need mastectomi chemotherapi radiotherapi everyth move fast diagnos speak whole day without end tear spoke friend famili colleagu devast say word breast cancer month chemotherapi notic littl lump skin right breast turn local recurr notic told doctor quick could give right treatment soon possibl need radiotherapi differ chemotherapi piec skin remov local recurr treatment biggest challeng deal fear cancer return usual fear start thought pop head got pain somewher new helen time helen found help tip manag worri recurr includ accept day better other tri week rule find plus tip move forward breast cancer free becca app https breastcancernow org inform support support beccautm sourc facebooko utm medium social utm campaign servic utm content becca,1,,,,
239,,diagnos secondari breast cancer clock tick liter buy time everi singl dose drug time live abl wife mother daughter sister friend clair abl access effect drug biggest prioriti peopl live secondari breast cancer help us ensur everyon secondari breast cancer fast access effect treatment sign petit http bit ly psd uf,1,,,,
240,,partnership breast cancer vital oldest retail uk reach far platform huge million astound amount money fund research care liter lifesav long union continu octob bring fund research care helen breast cancer campaign model helen took part campaign rais near breast cancer year combin activ includ campaign colleagu custom fundrais store donat post surgeri bras swimwear fantast product line mark spencer rais incred million breast cancer fund hour pioneer breast cancer research thank continu support choos breast cancer chosen chariti spark chariti donat everi time shop https www marksandspenc com myspark,1,,,,
241,,although need chemotherapi past month taken toll physic mental day even energi eat find person stori like carolin plus hint tip adjust life treatment free becca app https bccare org uk becca,1,,,,
242,,diagnos novemb year old rememb surgeon breast cancer confirm cancer cri kept say husband away year old see go school love much want leav phone husband devast cri realis us point chang live forev mum look daughter rang tell carri normal need time process let daughter know drove home beyond parent live hour away dad home went tell beauti sister drove mum see face realis heartbreak caus still left guilt day diagnosi saw us confirm grade stage lymph node involv hear extra kick stomach prepar start chemo decemb tri freez egg day harvest decid need chemo heartbroken genet test worri daughter sister niec want reliev came back negat littl part thought week radiotherapi continu rang medic daili month zoladex inject week herceptin journey far day day activ treatment hardest back work teacher sens purpos abil forget wonder confid weight gain medic mastectomi infertil loss hair battl tri fight daili well mental privileg wonder famili around tri live fear recurr live moment gemma diagnos breast cancer share speech virtual carol candlelight join us virtual magic set st paul church knightsbridg annual carol servic wednesday decemb inspir read uplift carol even rememb join us help us reach aim everyon develop breast cancer live support live well https breastcancernow org get involv social event carol candlelight londonutm sourc facebooko utm medium social utm campaign carolsbycandlelight utm content gemma,1,,,,
243,,janet shot beauti photo truth document breast cancer experi diagnos breast cancer last januari imagin huge shock felt well never thought would start treatment straight away first chemotherapi session develop problem wound lymph node surgeri mean continu cours chemo treatment unfortun treatment enough kickstart side effect chemo lost much hair cours sever week use cold cap hope case draw process everi time wash brush hair came next month continu target therapi drug surgeri time hair start grow back begin septemb restart chemo remain session bother cold cap work lost hair quit quick hate look without hair dont feel like particular eyebrow gone wig most wear hat scarv never go head uncov final chemotherapi week ago hair start regrow slowli want document chapter life want proper photo taken good light like see way want share everyon passion photographi decid tri newli built studio idea imag hint look research would light technic difficult exercis set focus light pleas result posit comment peopl pictur realli boost confid look although still readi go nake head see janet photographi facebook account https www facebook com janetmilesimag mani peopl lose either hair result treatment breast cancer find breast cancer hair loss websit http bit ly rx fw,1,,,,
244,,juli refer mammogram told need ultrasound hour initi arriv hospit told breast cancer follow day consult rang say would like routin bone scan fast forward week confirm cancer spread rib secondari breast cancer physic felt well earli menopaus emot happen treatment work first diagnos head neck consult said treatment settl almost forget get life normal pretti much victoria,1,,,,
245,,put mask makeup paint eyebrow put wig everyon say look amaz use think saw hour ago wouldnt say look healthi start treatment end look like youv gone mill hard get use look mirror see bodi chang week week hear word cancer everyth feel scari friend recent diagnos piec advic ive given afraid treatment difficult mani support option help honest your feel around make easier breast cancer feel like put paus life life wont hold forev there much wait beyond treatment toria find person stori like toria plus tip move forward breast cancer free becca app https breastcancernow org inform support support beccautm sourc facebooko utm medium social utm campaign servic utm content becca,1,,,,
246,,although need chemotherapi past month realli taken toll physic mental day even energi eat carolin struggl sever fatigu treatment find stori plus tip look physic wellb treatment free becca app http bit ly ou tbd,1,,,,
247,,lumpectomi remov tumour surround tissu sentinel lymph node remov april follow week went back follow appoint told need surgeri thank didnt need chemo need radiotherapi tamoxifen year found difficult sit still rest oper usual activ person week treatment fatigu hit strangest thing ever experienc day fine next like hit ton brick first difficult adapt mindset alway person everyth instead ask help mum think sometim easier realis import allow peopl help weak ask help hard famili friend treatment know help let children fab throughout honest care help around hous daughter took role nurs cute bring medicin pain relief need alway resili person sinc diagnosi found thing challeng time remind ive huge tough chang attitud made reassess want life diagnosi prepar career reflect prioriti chang decid put hold moment focus famili full recoveri aisl,1,,,,
248,,fear confirm tumour spread lymph node new year go mark start breast cancer treatment simon drove home stun way expect real could knew tell children simon medic retir kidney transplant fail mode dialysi live simon abl chang drastic alway honest children simon health look book help us explain chang live unsuccess use knowledg experi answer difficult question daddi arm buzz daddi tube come tummi daddi carri anymor time around breast care nurs given us book children mummi lump publish breast cancer care help understand breast cancer ahead fair explain thing children way learn come term situat face knew experi simon ill would less fear procedur knew happen got home sat told diagnosi explain cancer catch none us caus told doctor said could treat medicin surgeri x ray gave big hug answer question anita anita share experi tip tell children breast cancer us find stori plus tip move forward breast cancer free becca app https breastcancernow org inform support support beccautm sourc facebooko utm medium social utm campaign servic utm content becca,1,,,,
249,,cancer unexpect lodger turn caus chao final get rid realis kept key jenni diagnos discuss languag use describ breast cancer make feel uncomfort,1,,,,
250,,obvious tear bit anger jealousi other carri normal live whole life becam treatment trip hospit get day win today melani breast cancer diagnosi melani start wonder ever possibl win breast cancer,1,,,,
251,,found lump right breast novemb mammogram sever ultrasound told cyst drain sent way unfortun doctor spot tumour grow behind doubl size unabl go back treatment due covid pandem biopsi given diagnosi th wait hard told grade invas ductal carcinoma grown cm novemb cm famili utter devast upon hear news life went technicolour black white less hour heidi diagnos breast cancer recent finish chemotherapi share difficult emot side effect came treatment,1,,,,
252,,treatment finish expect feel like new person struggl ongo physic side effect cord surgeri unabl pilat due muscl tighten chest upset went fit unfit felt frustrat time take get better physic physiotherapist suggest join dragon boat race team call wave walker peopl experi cancer enjoy learn particip someth new stop usual activ part team embarrass cancer import peopl wave walker socialis support member come rang background part london paddl fun get fit recoveri breast cancer immedi slowli get everyon tri new thing like dragon boat race realli help treatment find person stori like jacki plus tip move forward breast cancer free becca app https breastcancernow org inform support support beccautm sourc facebooko utm medium social utm campaign becca utm content becca,1,,,,
253,,denis breast cancer experi start back simpl letter tell need return hospit discuss result routin breast screen appoint chang life forev ive surpris find live post treatment hardest part anxieti breast cancer come back never far mind sinc given hope vital research breast cancer fund life chang support breast cancer care women diagnos breast cancer everi year uk help us support peopl like denis https bccare org uk lyrpnv,1,,,,
254,,although need chemotherapi past month taken toll physic mental day even energi eat find carolin blog manag fatigu plus hint tip life treatment free app becca https bccare org uk becca,1,,,,
255,,high risk patient day low immun system due treatment breast cancer time year mastectomi reconstruct lumpectomi chemotherapi radiotherapi recent diagnosi think back time diagnos breast cancer get virus feel fortun first diagnos breast cancer still fight ruth diagnos primari breast cancer time complet hospit treatment diagnos covid,1,,,,
256,,never expect hear breast cancer initi told lump breast probabl noth worri consult said biopsi show cancer hear anyth els said felt numb came anger upset frustrat boy imagin absolut worst fortun amaz support network famili friend well support breast care team wobbl difficult day peopl talk know listen support outsid closest find person stori like leann plus tip move forward breast cancer free becca app https breastcancernow org inform support support beccautm sourc facebooko utm medium social utm campaign servic utm content becca,1,,,,
257,,take minut life everi month check breast save endur https bit ly exdmju https breastcancernow org us news person stori breast cancer incur e stop live lifeutm sourc facebooko utm medium social utm campaign corpor utm content ghdlaura laura first diagnos breast cancer find lump breast travel year finish treatment primari breast cancer laura told cancer back time spread bone shes share stori togeth young women breast cancer around world remind peopl check sign breast cancer part ghds take control campaign,1,,,,
258,,learnt cancer chang person physic tire lot time plenti menopaus symptom emot longer level head person whose mood swing like yo yo find person stori like sara plus tip move forward breast cancer free becca app http bit ly ou tbd https breastcancernow org inform support support beccautm sourc facebooko utm medium social utm campaign becca utm content beccasundaypostfb,1,,,,
259,,biggest challeng deal fear cancer return usual fear start thought pop head got pain somewher new find helen blog manag fear recurr plus hint move forward treatment becca app https bccare org uk becca,1,,,,
260,,breast cancer work complet chang life path gave real purpos would like say big congratul kerri bank award british empir medal bem queen new year honour list servic breast cancer sinc kerri rais memori friend juli work tireless rais awar breast cancer host event ball sponsor walk take challeng dalai lama himalayan trek incred ambassador breast cancer thank kerri,1,,,,
261,,woke januari decid go year thought resolut made determin sure everyon keep rememb celebr night taken shower discov lump right breast felt breast found lump still began differ journey envisag lone journey would leav exhaust unwel face futur expect anyon diagnos cancer know thing happen quick whole process hard keep assimil week instead look new job resolut say tear goodby colleagu go treatment famili love support sympathet anxious hand space spare energi anxious begin understand mean journey truli understood least follow mastectomi start chemotherapi join group breast cancer care forum peopl women men due start chemotherapi march henc becam marvel marchi show sister video said write blog lone journey said think kid could see think alon husband children mother friend could lone get wrong lot support new virtual friend forum share fear anxieti famili anxieti laugh thing famili feel appropri laugh talk possibl pull connect middl night love one asleep lay wide awak georgi find person stori like georgi plus tip move forward breast cancer free becca app https breastcancernow org inform support support beccautm sourc facebooko utm medium social utm campaign servic utm content becca,1,,,,
262,,youv probabl someon say treatment finish your better cancer bad cold treatment caus side effect last mani year read alex blog manag fatigu plus tip move forward treatment free app becca https bccare org uk becca,1,,,,
263,,longer see lop side breast eye go tattoo see love flower make feel good read liz person stori inspir hint tip life breast cancer free becca app https bccare org uk becca,1,,,,
264,,nurs addi talk live kayla first diagnos breast cancer import breast awar would like ask them,1,,,,
265,,diagnosi much bigger emot impact expect thought finish treatment would done dust intens cancer treatment much deeper impact realis stay quit time peopl talk defin cancer feel way part influenc feel life find person stori like isla plus tip move forward breast cancer free becca app http bit ly ou tbd https breastcancernow org inform support support beccautm sourc facebooko utm medium social utm campaign becca utm content beccasundaypostfb,1,,,,
266,,mum die age breast cancer somehow alway knew back mind would face breast cancer stage life juli small lump insist gp refer consult didnt think would anyth worri fast forward lumpectomi discov grade infiltr ductal carcinoma anoth surgeri follow week martial mastectomi wider excis remov lymph node follow session radiotherapi watch lorrain saw featur show breast cancer care affili began servic avail invalu appli model join catwalk join show committe want want spread word chariti use passion experi posit way sad show happen year want spread posit support reunight keep rais much money possibl tracey diagnos breast cancer year ago committe member show join forc pink ribbon ball committe breast cancer first virtual event reunight join us novemb chanc win prize see special perform hear uplift stori rais money vital work www breastcancernow org reunightutm sourc facebooko utm medium social utm campaign reunight utm content tracey https breastcancernow org get involv social eventsutm sourc facebooko utm medium social utm campaign reunight utm content tracey,1,,,,
267,,want turn bad situat good situat rais money tickl pink hilari shave head upcom oper rais asda tickl pink campaign new year fundrais way help rais vital fund breast cancer http bit ly ep wx https breastcancernow org search googl get involv fundrais,1,,,,
268,,way dealt diagnosi posit happen want know need next other might better close door lie bed day process news everyon reaction differ let anyon tell deal diagnosi know best find person stori like samantha plus tip move forward breast cancer free becca app http bit ly ou tbd https breastcancernow org inform support support beccautm sourc facebooko utm medium social utm campaign becca utm content beccasundaypostfb,1,,,,
269,,happi diagnosi day exact year ago told word never thought would hear cancer still way go recoveri tough oh tough worst year life done move know learnt much superwoman laura wrote letter exact year breast cancer diagnosi read full letter here,1,,,,
270,,petrifi stage catch covid sure whether continu treatment thought would rather take risk cancer come back leav children without mother aw time last year francesca diagnos breast cancer lost husband year struggl handl treatment pandem share famili help cope,1,,,,
271,,face choic reconstruct consult give fact pass breast care nurs fill detail give time process inform given struggl decid best serious ill year everyth els recent happen life question decis make abil fear make mistak worri time work requir care son recoveri time selfish could implant back normal quicker struggl scar could occur part bodi like breast torso question vaniti endless sara jane,1,,,,
272,,expect worst chemotherapi tough treatment rob thing made feel like woman period stop hair fell even eyelash eyebrow went high risk recurr recommend bilater mastectomi follow reconstruct difficult lose thing time thought go woman whos go want find person stori like leann plus tip move forward breast cancer free becca app http bit ly ou tbd https breastcancernow org inform support support beccautm sourc facebooko utm medium social utm campaign becca utm content beccasundaypostfb,1,,,,
273,,sinc januari ive take tamoxifen biggest issu hot flush sweat muscl cramp insomnia read helen tip manag menopaus symptom heat plus hint adjust life breast cancer free app https bccare org uk becca,1,,,,
274,,hair start grow back even peopl know well recognis straight away difficult moment happen remind find patricia stori plus hint tip find new normal treatment free becca app https bccare org uk becca,1,,,,
275,,mum diagnos tripl negat breast cancer late doctor found small lump year routin check initi breast cancer return time first breast lung brain massiv impact famili sibl young time fulli understand happen felt quit isol lone talk mum found alter brca gene put high risk breast cancer incred confus never heard expos cancer world month earlier idea cancer could hereditari mum heard brca understand affect parent later realis grandpa carrier encourag mum appli genet test novemb took test day th birthday februari receiv result mid april came back posit strang reliev felt grate found young age meant time discuss think option jess,1,,,,
276,,partner iain taken room consult told sorri breast cancer world fell apart seem real felt like talk somebodi els felt complet numb scare boy futur diagnos invas ductal carcinoma stage breast cancer spread lymph node absolut terrifi initi thought young son go tell news youngest year old surpris cope incred well day quit ill see tear worri,1,,,,
277,,isla diagnos breast cancer tokyo away husband children alreadi suspicion someth wrong doctor recommend biopsi biopsi result flew back home edinburgh cut trip short week diagnosi much bigger emot impact expect thought finish treatment would done dust intens cancer treatment much deeper impact realis stay quit time,1,,,,
278,,began wonder cancer last month go back sure know happen next,1,,,,
279,,woke saturday morn hair quarter inch long came downstair said ross wear wig anymor,1,,,,
280,,year diagnosi fran share thing help get breast cancer treatment manag hair loss took look mirror morn thought look aw smile back sudden look much nicer hide beneath pale red eye bald imag saw instant felt littl better smile lot find lost energi read walk would good increas energi level boost immun start walk everi day day feel like go would make take least step deal sad thought end everi day attempt sleep went everyth achiev wrote diari list far walk record step wrote felt way could go sleep posit frame mind sometim even feel littl bit proud find person stori like fran plus tip move forward breast cancer free becca app http bit ly ou tbd,1,,,,
281,,treatment finish thought id feel elat felt quit deflat way cancer life sudden treatment happen strang feel find lauren blog plus tip take care emot wellb treatment end becca app search becca app app store,1,,,,
282,,implant big decis fact make decis breast reconstruct easi everyon free boob job cosmet procedur attempt regain sort normalci traumat life chang event breast cancer fiona,1,,,,
283,,found lump left breast saw gp day hospit quick mammogram ultrasound biopsi week sad got diagnosi tripl negat breast cancer went lockdown vulner told isol shield thank husband abl isol hes fantast grate basic carer whole famili isol togeth march apart hospit appoint never went got shop deliveri asda friend home shop bring littl food parcel id like say massiv thank everyon asda support phenomen husband make realis hard time forti year old asda colleagu helen whos marri fellow asda colleagu childhood sweetheart rob year diagnos breast cancer last year treat love valentin day pick bunch asda tickl pink flower local asda give beauti gift love support us coppafeel rais vital fund world class research support affect breast cancer educ communiti colleagu custom supplier breast awar link https www asda com creat chang better better communiti tickl pink,1,,,,
284,,partner iain taken room consult told sorri breast cancer world fell apart seem real felt like talk somebodi els felt complet numb scare boy futur tri keep thing normal possibl carri school run kept activ could day abl get bed day felt well walk dog met friend lunch import keep sens normal boy famili friend dark day chemo got knew feel bad forev stay posit kept go lesley lesley diagnos breast cancer first thought children treatment tri hardest continu normal even struggl get bed find person stori like lesley plus tip move forward breast cancer free becca app https breastcancernow org inform support support beccautm sourc facebooko utm medium social utm campaign servic utm content becca,1,,,,
285,,thought id feel elat thought id jump around felt quit deflat way whole time cancer life sudden treatment happen strang feel find person stori like lauren plus hint tip adjust life treatment free becca app http bit ly ou tbd,1,,,,
286,,deal tamoxifen side effect beauti warm weather interest biggest issu hot flush sweat muscl cramp insomnia find helen blog manag menopaus symptom heat plus tip move forward breast cancer free becca app https bccare org uk becca,1,,,,
287,,finish treatment thought wow im back normal worri kick long process ive gone back forth doctor tamoxifen given menopaus symptom ive realli struggl find toria stori manag life treatment plus tip move forward free becca app https bccare org uk becca,1,,,,
