,Unnamed: 0,Message,Narrative,Unnamed: 3,Unnamed: 4,Unnamed: 5,Unnamed: 6
645,,yesterday felt like first time thank bodi sinc quarantin start cancer promis thing differ treat bodi good work take time workout eat right drink less take time covid took care work rest goal spiral liter done none sinc quarantin goal self care year went window let negat camp brain easili affect peopl energi get consum shut yesterday chose get outsid small workout cook healthi face mask took bath choos tea wine matter bank account look like stock fridg high bill pile take even minut today thank bodi work deserv keep go friend let come still kick,1,,,,
646,,feel differ face cancer quit articul come side still exact sure defin differ say grate cours face breast cancer life alter event julia loui dreyfus share understand might simpl definit survivor feel face cancer hope julia word outlook reson navig survivorship,1,,,,
647,,rachel wrote us share best friend sarah inspir everi day covid pandem sarah famili receiv news breast cancer diagnosi sudden face manag busi pandem navig virtual learn kid breast cancer diagnosi top watch brave storm inspir thing ever seen husband perfect put recent never underestim sarah abil rise occas alway continu show famili friend compani kept usual posit attitud chemo treatment root come season challeng stronger ever,1,,,,
648,,olivia strong come diagnos stage breast cancer last septemb still current undergo treatment shes singl mom young children say faith hope carri journey share give cancer biggest hardest hit realiz much stronger cancer walk faith becam stronger believ anyth celebr month breast cancer survivor,1,,,,
649,,join us send beauti mom warrior word encourag hope continu undergo treatment journey stir feel appreci mind courag roshni share,1,,,,
650,,face breast cancer made honest honest want daughter capabl face mortal honest everyon els seem easi diagnos age stage invas ductal carcinoma breast cancer week pregnant idea mom let alon mom cancer upon diagnosi decid daughter savannah would born month earli via c section would bilater mastectomi day later needless say heal process monstrous savannah born healthi nicu need beauti newborn babi couldnt proper bond permit breastfe mastectomi afterward permit hold lift carri terrifi earli motherhood experi failur month chemotherapi follow round radiat newborn number time broke numer honest know feel normal flood negat emot fear anger denial hatr realiz let go realiz fight daughter longer today happi healthi overcam odd togeth know daughter see world beauti hold everi day,1,,,,
651,,sheri embodi bald beauti love share touch word us cancer take lot couldnt take abil set atmospher would go way experienc breast cancer would way everyon around would experi chose count bless focus posit find joy journey,1,,,,
652,,ashley count day done treatment recent finish fourth round chemotherapi celebr mileston share insight physic mental challeng face mom tri navig breast cancer finish fourth round chemo im tire im proactiv rest give toddler best home daycar right cant activ mom use make read book snuggl togeth cant wait maximum health play hard pleas take moment share uplift word ashley support rejuven need today,1,,,,
653,,heart prayer go women like patti brave breast cancer diagnosi courag strong support,1,,,,
654,,diagnos routin mammogram mom year old year old month old babi neglect get mammogram year prior tri get thing somewhat regul gynecologist remind need schedul mammogram went got call come back pictur soon need go back biopsi honest bit aggrav teacher realli want take time famili histori breast cancer didnt think anyth concern unfortun biopsi came back cancer diagnos posit breast cancer partial mastectomi radiat treatment grace god cancer free sinc march call surpris babi boy messeng babi issu pregnanc probabl would skip mammogram ladi pleas stay top mammogram mine save life,1,,,,
655,,multipl round chemotherapi christina treatment conclud share thank everi day look forward start new chapter join us celebr mileston christina breast cancer journey,1,,,,
656,,day left valentin day year forgo candi heart flower send gift make last impact join us provid gift hope encourag women undergo breast cancer treatment still hundr women like michell wait receiv hope kit valentin day learn help http bit ly gabujb,1,,,,
657,,diagnos breast cancer weslinn began navig chemotherapi treatment plan surgeri sinc april face mani trial confid courag grit journey find joy midst pandem incred encourag https www today com health coronavirus breast cancer stop mom wed t,1,,,,
658,,barbara recent share person journey us comment section post said go treatment realli hard moment go chemo second time treatment go wait finish sit chemo hour aw husband sit park lot entir time heartbreak yes nurs tire work hard camaraderi care patient second none best support patient excel noth much troubl take hat staff real angel send hug posit thought cancer patient time tough get togeth warrior love messag hope uniti,1,,,,
659,,past februari age thirti diagnos dcis breast cancer week husband found wonder news expect first babi travel initi emot shock fear anger grief shift energi toward hope determin refus let diagnosi defin instead remain someth overcom twenti week pregnant miracl babi help us success get mastectomi surgeri without complic journey experi taught mani invalu life lesson learn stay confid listen bodi lean biggest support need never ever give hope begin greatest adventur parent fit jane born breast cancer awar month fierc light ever known sarah snapshotofhop touch heart today endur resili hope outlook inspir wish littl famili happi healthi life togeth,1,,,,
660,,year cancerversari jill goodacr wife harri connick jr open first time breast cancer journey admir courag speak breast cancer awar month share hope other face diseas read below,1,,,,
661,,sonia want world know amaz sister donna donna recent diagnos breast cancer shes determin navig journey posit mindset heart fill hope week ago sister diagnos tripl negat breast cancer inspir abil maintain feisti humor spirit spite news daunt treatment honest cant say would shoe prepar journey like shes alreadi couldnt proud call sister,1,,,,
662,,diagnos breast cancer im bless say survivor cancer step stone mani great thing life follow pain season im thank second chanc life never late begin gloria celebr year breast cancer survivor want ignit hope women navig diseas,1,,,,
663,,carri like mani tripl negat breast cancer survivor continu oral chemotherapi part survivorship care plan shes reach end treatment excit share news love one friend follow along journey say go peopl whirlwind week go let get way celebr small victori help us celebr carri hopejourney mileston comment below,1,,,,
664,,heidi recent celebr last chemo happi addit full gratitud appreci everi day join us cheer heidi throughout rest journey,1,,,,
665,,newest blog tommi candid share experi caregiv husband father wife breast cancer journey along word hope navig survivorship look back would tell men care wive love one face breast cancer rock stay vulner express emot loud hug cri togeth whoever need remind even cancer read stori https bit ly jgqhsf https www nationalbreastcanc org way life husband breast cancer survivor,1,,,,
666,,nation breast cancer foundat found person experi founder ceo janell hail year breast cancer survivor advoc women health janell diagnos breast cancer age time diagnosi littl inform diseas forc make decis health option treatment janell made commit help women around world educ breast cancer import earli detect learn nbcf help women visit websit nbcf org,1,,,,
667,,kick breast cancer awar month honor breast cancer survivor way inspir us erin diagnos pregnant remind us stay awar beauti thing,1,,,,
668,,admir erin courag cervic cancer treatment share stori glad hear show evid diseas insight cervic cancer expert serv remind talk doctor recommend screen breast cervic cancer,1,,,,
669,,ericka celebr cancer free advoc women breast health share would like bring awar women possibl sign breast cancer women know comfort bodi voic survivor want use promot import earli detect mammogram import pap smear overal health,1,,,,
670,,joan lunden public face breast cancer inspir women everywher commit make differ breast cancer journey inspir other protect health joan share touch word us think part human instinct fight life threaten battl find side survivor desir reach hand help next woman journey,1,,,,
671,,face cancer diagnosi make wake becom awar fragil life life forev chang heartbeat diagnos metastat breast cancer januari finish chemo doubl mastectomi year old hardest choic ever make thank god everi day live love laugh face diseas dont ever give pleas join us send posit word encourag karon begin radiat treatment,1,,,,
672,,member team hope share experi get first mammogram covid christina point view self care great remind import health even pandem read stori https bit ly cul ox https www nationalbreastcanc org lesson self care mammogram covid,1,,,,
673,,breast cancer awar month mickey inspir hope excit finish treatment sometim treatment patient endur multipl round chemotherapi radiat even surgeri thought current walk journey,1,,,,
674,,receiv hope kit jill said exact need right diagnos recent widow dont lot support home creat hope kit women like jill help bring back lowest women diagnos breast cancer everi day valentin day mission make women feel love honor provid hope kit join us deliv hope kit recent diagnos women valentin day help donat http bit ly rhztdi,1,,,,
675,,rhonda strength determin spirit noth short miracl im bless everi day wonder give wife pray day individu famili battl breast cancer take journey day time today good day chet share wife rhonda last surgeri octob join us send well wish time recoveri heal,1,,,,
676,,face breast cancer made awar precious life matter minut everyth chang diagnosi affect love one well thank support receiv treatment receiv love envelop grate survivor,1,,,,
677,,go breast cancer made decis tell famili complet treatment thing learn time never shut famili alway good support love one side go someth life chang,1,,,,
678,,past march evelyn receiv heartbreak news breast cancer reflect experi said felt like life jeopardi cri entir day convinc wasnt anyth els fight hard admir strength resili,1,,,,
679,,survivor inspir us everi day fill blank let us know mani year survivorshipstrong are,0,,,,
680,,moment realiz someth isnt right feel youll never forget find lump abnorm mammogram hear word cancer unforgett moment youv face breast cancer tell us cancer detect,0,,,,
681,,face breast cancer tough around share news love one endless doctor appoint treatment session fear recurr noth cancer easi toughest part journey share survivor experienc challeng,0,,,,
682,,alon someon side support diagnos coronavirus pandem everi survivor stori differ want hear you,0,,,,
683,,million cancer survivor unit state everi survivor uniqu share import characterist inspir hope other today everi day celebr braveri strength willpow happi nation cancer survivor day,0,,,,
684,,today worldcancerday lend voic unit impact cancer,0,,,,
685,,cheer nationalcancersurvivorsday today day hope diagnos type cancer bold brave beauti share friend let know your survivor,0,,,,
686,,earli detect tool like mammogram remain first line defens breast cancer survivor said breast cancer detect mammographi tell us mammogram help save life,0,,,,
687,,fear possibl cancer recurr debilit hear survivor tell us treatment end celebr sometim short live fear breast cancer come back stay us even day feel best anxieti normal part survivorship journey alon hope share thought survivor perspect help inspir courag someon struggl,0,,,,
688,,lose hair due chemotherapi treatment hardest time breast cancer journey choos face new realiti,0,,,,
689,,want hear word breast cancer heartbreak sober accept new normal comment tell us felt moment,0,,,,
690,,recent studi conclud approxim women reconstruct surgeri mastectomi women might feel pressur surgeri other simpli person prefer make decis reconstruct surgeri want hear comment below,0,,,,
691,,day work keephopeal heart face breast cancer world cancer day lend voic support impact diseas touch mani live,0,,,,
692,,million survivor u keep hope aliv tag survivor share stori comment,0,,,,
693,,nation breast cancer foundat myplat com team help spread hope awar breast cancer person tx licens plate texan creat custom plate proud proclaim support help fund nbcf program everi pink plate octob plate say http bit ly b hxkx,0,,,,
694,,hear word breast cancer turn life upsid mani women say transform experi whether posit negat want hear learn throughout journey share us comment below,0,,,,
695,,post mastectomi recoveri difficult navig would like hear experi help make comfort either home hospit,0,,,,
696,,radiat therapi caus uncomfort side effect dri irrit skin discolor onset fatigu experienc side effect,0,,,,
697,,breast cancer diagnosi life alter share comment youv learn throughout journey,0,,,,
698,,awkward pain uncomfort easi life save word weve heard use describ mammogram want hear first mammogram like,0,,,,
699,,know lot breast cancer patient face differ treatment plan tax tell us hardest part treatment,0,,,,
700,,take moment consid import women life know someon touch breast cancer,0,,,,
701,,hope courag believ stronger togeth join us beacon hope light comment heart,0,,,,
702,,mani patient experi various eye issu cancer treatment known symptom includ irrit dri eye tear red pain blur vision experi,0,,,,
703,,breast cancer gruel physic emot octob want start convers around realiti breast cancer good bad ugli follow along us join convers,0,,,,
704,,honor breast cancer awar month share new custom hope frame profil pic perfect way show friend stand us hope face breast cancer alon tri now,0,,,,
705,,nation cancer survivor day sunday share friend strong hope are,0,,,,
706,,know say love diagnos cancer difficult wed love hear experienc comfort thing peopl said want hear friend famili most,0,,,,
707,,lose hair due chemotherapi hardest realiti breast cancer patient face your survivor alreadi gone wed love share advic soon face this,0,,,,
708,,today everi day work keephopeal provid help inspir hope face breast cancer worldcancerday iamandiwil,0,,,,
709,,seen heard mani stori love one cancer patient shave head solidar wide rang feel live cancer toward gestur hair loss emot part breast cancer journey experi person next would love hear feel topic encourag share stori below,0,,,,
710,,lot women told us perspect outlook life chang drastic breast cancer diagnosi breast cancer diagnosi chang outlook life,0,,,,
711,,know million breast cancer survivor unit state includ women still treat complet treatment survivor continu heart work hard everi day toward mission help women now,0,,,,
712,,face life chang diagnosi like breast cancer often creat strong disconnect around us similar experi welcom share thing wish love one would understand navig life diseas,0,,,,
713,,undergo treatment cancer challeng physic emot comfort word encourag advic eas side effect fun tip pass time someon similar experi could help spark hope patient heart treatment share other comment below,0,,,,
714,,today want give big shout caregiv men women real mvps take patient appoint run errand shoulder cri caregiv constant perform selfless act kind make big differ youv face breast cancer tell us caregiv made differ throughout journey,0,,,,
715,,ask listen hope face mask avail pre order wear face mask style support breast cancer awar pre order http bit ly hopemask https nbcfshop com collect accessori product hope face mask,0,,,,
716,,undergo treatment breast cancer general support team medic profession includ oncologist breast surgeon well primari care physician medic terminolog number appoint feel overwhelm time help navig complex cancer care facil like one partner offer support patient navig help coordin care face breast cancer patient navig impact journey,0,,,,
717,,fear breast cancer come back stay us even day feel best survivor cope fear recurr,0,,,,
718,,nurs often bright light throughout difficult process treatment tell us nurs meant you,0,,,,
719,,men women face metastat breast cancer come term differ diagnosi symptom side effect similar breast cancer patient stage patient mani stark realiti must face journey take moment read strong metavivor wish peopl would acknowledg http bit ly klr https www everydayhealth com hs breast cancer metastat breast cancer wish peopl knew,0,,,,
720,,pink product pink ribbon pinktob breast cancer awar month rais awar fund continu provid life save servic women need awar mix feel bcam share us feel anyth observ support special month,0,,,,
721,,today nation metastat breast cancer awar day metastat breast cancer cancer spread outsid breast area bodi bone lung brain stage patient often endur lifelong treatment prevent growth diseas manag symptom continu keep affect metastat breast cancer thought prayer,0,,,,
722,,survivor brave beauti strength overcom inspir us everi day,0,,,,
723,,join us throughout month octob encourag undergo treatment support resili survivor honor memori pass keephopeal everi day breast cancer awar month,0,,,,
724,,breast self exam help familiar breast feel look practic least month alert healthcar profession discov chang inform perform breast self exam visit https bit ly jo k https www nationalbreastcanc org breast self exam,0,,,,
725,,sometim word fail music speak simpl song stir emot move us even inspir strength persever would love know song lyric help hard day breast cancer journey,0,,,,
726,,mastectomi common procedur breast cancer patient endur mani women go surgeri talk emot decis share experi comment below,0,,,,
727,,breast cancer diagnosi chang cours life prioriti chang simpl task becom difficult help thing peopl eas burden share us comment below,0,,,,
728,,accord nation cancer institut breast cancer detect earli local stage year relat surviv rate earli detect includ month breast self exam schedul regular clinic breast exam mammogram increas chanc detect breast cancer earli check free guid step earli detect https www nationalbreastcanc org earli detect guid https www nationalbreastcanc org earli detect guid,0,,,,
729,,emot support cancer survivor need everi step even treatment conclud reliabl support system key manag new normal survivorship sad breast cancer survivor say support love one decreas complet treatment experi like share comment below,0,,,,
730,,octob year long offer hope women affect breast cancer,0,,,,
731,,nation mammographi day share import remind lilli shockney schedul mammogram march like instruct delay screen covid pandem control possibl even doesnt mean mammogram isnt import necessari healthcar provid want keep safe possibl time come pleas get reschedul import screen test still month breast self exam look chang last month month find someth see provid might even want get diagnost mammogram ensur well healthcar facil includ breast imag facil take great measur keep safe,0,,,,
732,,undergo treatment chemotherapi immunotherapi radiat therapi result short long term side effect side effect often begin start treatment steadili linger develop mani year post treatment mani survivor open share suffer ailment memori loss fatigu sad even infertil cope chronic side effect sinc end breast cancer treatment pleas share comment below,0,,,,
733,,hope kit care packag messag hope share patient activ treatment breast cancer pack love hope kit full comfort encourag item patient find help undergo breast cancer treatment check nbcf org inform hope kit support servic,0,,,,
734,,common symptom breast cancer includ new lump breast underarm armpit thicken swell part breast irrit dimpl breast skin bodi show earli warn sign encourag consult doctor immedi detect breast cancer earli stage help save life learn symptom sign breast cancer visit bit ly nqxepj,0,,,,
735,,breast cancer case diagnos local stage sign cancer spread outsid breast year surviv rate earli detect key could save life breast cancer detect earli treat success increas chanc surviv mammogram best way detect breast cancer earli today nationalmammographyday encourag proactiv breast health schedul screen,0,,,,
736,,today everi day thank hope inspir found heart survivor everywher,0,,,,
737,,term cancerversari well known breast cancer communiti use describ anniversari specif time date event life person touch diseas survivor choos celebr mileston way look back far come sinc diagnosi other choos dismiss period time reflect bad memori would love hear thought pleas share us feel cancerversari,0,,,,
738,,sometim need small remind strong resili are,0,,,,
739,,today nation cancer survivor day cancer affect us way want take moment celebr cancer survivor honour rememb whose succumb terribl diseas tell us,0,,,,
740,,age montana diagnos stage tripl negat breast cancer aggress subtyp typic affect young women women brca gene mutat montana screen annual sinc age find carrier gene annual mammogram ultim save life thank earli detect cancer read montana journey breast cancer http bit ly piisk http www getpinkd com blank f fund rais program like getpinkd support project aim find new way treat aggress breast cancer,1,,,,
741,,proud commemor year partnership cibc thank dedic cibcrunforthecur commit creat futur without breast cancer,0,,,,
742,,finish sentenc,0,,,,
743,,deanna king particip wonder support canadian breast cancer foundat cibc run cure sadden news pass thought famili friend,1,,,,
744,,februari canadian cancer societi ccs canadian breast cancer foundat cbcf join forc increas oper effici impact type cancer canadian unpreced merger allow new canadian cancer societi acceler impact donor dollar cancer research vital support servic peopl live affect cancer togetherwearestrong learn websit cbcf org,0,,,,
745,,want hear breast cancer stori tell us connect caus comment breast cancer diseas touch live mani famili friend communiti women men diagnos breast cancer canada year communiti help other,0,,,,
746,,breast cancer chang live thousand peopl everi year peopl like nadia sharon kimberley anjum learn person uniqu experi breast cancer survivor open help rais awar support other similar journey,1,,,,
747,,han christian andersen said word fail music speak want know,0,,,,
748,,inspir passion communiti answer frequent ask question breast cancer know matter mani includ metastat breast cancer impact canadian breast densiti affect breast cancer risk men get breast cancer find import inform topic bring awar latest blog,0,,,,
749,,finish sentenc,0,,,,
750,,diagnos experienc breast cancer want know,0,,,,
751,,largest studi date condit known chemobrain show women breast cancer report substanti problem chemotherapi long month treatment chemobrain refer type mental fog peopl experi chemotherapi includ problem think concentr memori read studi led michell c janelsin ph pictur http bit ly iex mx https www urmc rochest edu news stori chemo brain women breast cancer pervas studi show,0,,,,
752,,continu increas awar access post mastectomi breast reconstruct option canadian women bra breast reconstruct awar day event canada relationship communiti member physician inform access resourc anytim consult bra day websit bra day com,0,,,,
753,,want live fear find genet mutat put high risk breast cancer meghan underw doubl mastectomi age find encourag canadian learn health support other breast cancer journey cibcrunforthecur,1,,,,
754,,particip canadian cancer societi cibcrunforthecur year initi join cibc titl sponsor diagnos breast cancer felt person connect run desir give back breast cancer caus angi team cibc member diagnos breast cancer run took whole new mean angi see inspir other chang futur breast cancer http bit ly jtkzar,1,,,,
755,,thank support breast cancer caus offer lucki canadian cancer societi cibcrunforthecur support exclus prize packag westjet samsonit canada ritz carlton cancun everi fundrais donat onlin septemb pst octob pm pst enter chanc win roundtrip flight guest canadian westjet destin regular schedul market westjet destin winner receiv samsonit luggag set well night accommod ritz carlton cancun star oceanfront hotel provid ttitravelcanada miss chanc win incred prize packag valid decemb wait join run start fundrais enter chanc win full rule regul visit https bit ly ydo https support cancer ca site spagenavig rftc nw rule reg westjet htmls src soo facebook fwbc social subsrc westjetincent cibcrftc utm sourc soo facebook fwbc utm medium social utm content westjetincent utm campaign cibcrftc,0,,,,
756,,event like run continu make progress diagnos treat breast cancer give hope affect canadian cancer societi cibcrunforthecur person mean scott wife ann cibc employe whose famili member affect breast cancer scott open impact breast cancer live share determin ever make differ year reimagin run,1,,,,
757,,moment arriv lodg felt warmth compass staff resid form treasur friendship peopl knew exact feel offer comfort understand sharon found leav home month receiv breast cancer treatment felt especi scare anxious away love one difficult time stay canadian cancer societi lodg gave home away home could find strength courag peopl like sharon need travel outsid communiti life save cancer treatment lodg provid safe rest place stay focus heal grate partner like tetley canada support lodg communiti help us ensur face cancer alon,1,,,,
758,,thank support research discov breakthrough step treatment aggress form breast cancer tripl negat treatment combin cancer kill virus surgeri immunotherapi could prevent relaps potenti improv surviv rate aggress form cancer help continu drive progress breast cancer research support canada best brightest research http bit ly nz fcq,0,,,,
759,,call changemak honour someon special run regist creat person campaign canadian breast cancer foundat cibcrunforthecur http bit ly aadchn cibc,0,,,,
