,Unnamed: 0,Message,Narrative,Unnamed: 3,Unnamed: 4,Unnamed: 5,Unnamed: 6
0,,approach mother day want celebr mom life updat profil pictur show support everymom updat pictur susan g komen mother day frame easi,0,,,,
1,,heart go olivia newton john announc fight breast cancer second time time cancer metastas sacrum fight alongsid olivia,1,,,,
2,,everymom http sgk mn furqu http ww komen org everymom utm sourc social utm medium facebook utm campaign foreverymom,0,,,,
3,,year old michell diagnos metastat breast cancer lung brain michell faith children help keep head everi day hardest day help motiv you,1,,,,
4,,dimpl mammogram traumat biopsi lot lost sleep later breast cancer honey go life chang journey came appoint rememb memori day blurri like rain wash windshield surgeon oncologist sick ach explain pain consum idea come somewher came covid lock tighter safeti home part comfort anoth part scream free homeschool chemo homeschool chemo taddi darsey taddi journey big c women like taddi need help ever start fundrais komen today http bit ly tmum b https www facebook com susangkomen fundrais creat sourc nonprofit short url sourc data breferr sourc d,1,,,,
5,,start chemotherapi februari day radiat reconstruct begin month year hope would ordeal combin covid pandem surreal great support famili friend darlen langley breast cancer survivor http sgk mn zstqh https www komen org share stori darlen langley love posit attitud show darlen love comment,1,,,,
6,,shout survivor survivorship mean survivorstrong,0,,,,
7,,name nikia diagnos breast cancer year old time breast cancer treatment option limit fight life time friend biggest concern dress wear prom imagin breast cancer rock world like person share journey pleas click link connect http bit ly nr c,1,,,,
8,,fill blank,0,,,,
9,,kid metastat breast cancer tabatha ann power stori explain realiti live metastat breast cancer mom easi refus ever give read http sgk mn eosfuh,1,,,,
10,,name felicia robinson told age would breast cancer diagnosi round chemotherapi year old daughter step caregiv would believ felicia robinson breast cancer survivor susan g komen abl help women like felicia donat fundrais fuel mission creat facebook fundrais today help creat world without breast cancer http bit ly tmum b,1,,,,
11,,move shannen doherti open emot journey fight breast cancer real raw imag noth short power http abcn ws afqkbu http abcnew go com entertain shannen doherti share touch photo cancer battl storyid,1,,,,
12,,happi birthday month januari babi leiu birthday gift year consid fundrais komen honor special day donat go long way toward find cure breast cancer creat facebook fundrais today encourag love one support fundrais campaign http bit ly tmum b https www facebook com susangkomen fundrais creat sourc nonprofit short url sourc data breferr sourc d,0,,,,
13,,breast cancer touch live women u diagnos lifetim dolli parton jordin spark rita wilson sara evan monica came togeth breastcancerawarenessmonth imagin day pink anoth color song pink avail everywher portion proceed amaz song donat komen support mission listen share friend http bit ly pinksong https blog komen org blog pink anoth color,0,,,,
14,,chanc make impact women diagnos breast cancer lifetim join us live donat manduka projectom event bryant park hear men women affect diseas,0,,,,
15,,dimpl mammogram traumat biopsi lot lost sleep later breast cancer honey go life chang journey came appoint rememb memori day blurri like rain wash windshield surgeon oncologist sick ach explain pain consum idea come somewher came covid lock tighter safeti home part comfort anoth part scream free homeschool chemo homeschool chemo taddi darsey women like taddi need help ever friend xpo logist inc quadrupl everi gift make midnight tonight give today,1,,,,
16,,name felicia robinson told age would breast cancer diagnosi round chemotherapi year old daughter step caregiv would believ felicia help us make sure peopl get life save treatment servic need covid pandem start fundrais today http bit ly tmum b https www facebook com susangkomen fundrais creat sourc nonprofit short url sourc data breferr sourc d,1,,,,
17,,want hear stori unaccept breast cancer invad continu invad mani live fill blank via comment below,0,,,,
18,,sadden tell cancer come back cancer year ago high recommend annual mammogram mammogram found small lump breast dawn oswald live metastat breast cancer read dawn stori http sgk mn hxhckj https www komen org share stori dawn oswald,1,,,,
19,,mandi diagnos breast cancer thought diseas affect older women mandi diagnos day st birthday year later progress cancer becam metastat lost mandi earli detect save live live cure metastat breast cancer cure breast cancer mandi mandi right donat made komen week direct fund metastat breast cancer research donat today text mbc encourag local lawmak pass pend legisl help mbc communiti,1,,,,
20,,havent bought card gift mom donat komen choos free person ecard send mom send today http bit ly everymom,0,,,,
21,,young still begin career regist nurs focus way better patient last thing mind think cancer quick chang march receiv news year old want hear elizabeth must find cure elizabeth hundr thousand other around world face breast cancer donat made midnight tonight doubl doubl thank generous support donat becom give gift today elizabeth,1,,,,
22,,whether live breast cancer evid diseas support someon journey want hear share piec advic someon recent diagnos drop us line comment below,0,,,,
23,,youv got mimi let send word strength fight on,1,,,,
24,,year old michell diagnos metastat breast cancer lung brain kid faith help keep head everi day read stori http sgk mn xcmk v hardest day help motiv you,1,,,,
25,,look like young old male femal differ ethnic without hair hair pain pain chemo treatment radiat surgeri much tell us breast cancer look like you,0,,,,
26,,cancer care young old kristen rangel diagnos breast cancer age comment tell us point breast cancer enter life,1,,,,
27,,worldcancerday let forget breast cancer common cancer women worldwid komen work everi day fight breast cancer countri globe togeth make differ pledg help us world cancer day,0,,,,
28,,young still begin career regist nurs focus way better patient last thing mind think cancer quick chang march th receiv news year old want hear invas breast cancer read elizabeth jone stori http sgk mn etcbey https ww komen org breast cancer stori elizabeth jone html,1,,,,
29,,diagnos stage iv breast cancer shi th birthday fear would affect futur chanc famili learn live futur live starr coleman live metastat breast cancer power stori http sgk mn vmwctr nobodi ever diagnos breast cancer especi metastat diagnosi year old wont stop metastat breast cancer doe,1,,,,
30,,yesterday michell last day chemo let celebr mileston everyday hero like michell morethanpink,1,,,,
31,,tell us drop us line comment below,0,,,,
32,,chemo treatment week radiat go breastcanc survivor melani let show love celebr ring bell,1,,,,
33,,bold goal set enhanc emphasi find new treatment aggress incur form breast cancer leverag komen expertis identifi fund best innov breast cancer research research learn research imper http sgk mn cqrhq morethanpink,0,,,,
34,,nan,0,,,,
35,,colleen mother die breast cancer fight hard year colleen diagnos instant taken back familiar state fear mission creat world woman man experi fear need help accomplish lofti goal fundrais today http bit ly tmum b https www facebook com susangkomen fundrais creat sourc nonprofit short url sourc data breferr sourc d,1,,,,
36,,today sistersday celebr promis nanci g brinker made sister suzi year ago end breast cancer power sisterhood bond today everyth end diseas whether sister famili friend want hear celebr gift sisterhood,1,,,,
37,,marci murphi diagnos aggress tripl negat breast cancer month pregnant babi girl go lumpectomi chemotherapi complic deliveri emerg c section told would never walk talk would consid miracl year later kayle amaz im consid remiss kayle fulli function year old marci incred stori http sgk mn bcyl https www komen org share stori marci murphi,1,,,,
38,,love us first let celebr mom whether biggest cheerlead live memori tell us favorit momandm moment add filter photo mom,0,,,,
39,,week half ago kid side alisha finish last chemo invit komen communiti join us celebr strength,1,,,,
40,,amaz mileston shawn let celebr end chemo her,1,,,,
41,,jason hych everymom special mean mom kathi recent pass away metastat breast cancer mom meant world susan g komen race cure day alway emot day mom day repres happi everi day live metastat breast cancer reason celebr thank join mother day movement use photo filter donat komen buy mother day gift today http sgk mn furqu,1,,,,
42,,listen love beauti song son wrote mother fight breast cancer thought mom taylor take listen move tribut share us http bit ly pvrjud https www youtub com watchv x qiifyxt,1,,,,
43,,opri goe pink today day grand ole opri pink honor famili around globe impact breast cancer bit friend rita wilson victoria shaw erin kinsey perform new breast cancer anthem pink live opri portion proceed song support mission save live enjoy show,0,,,,
44,,ami keaton year old icu nurs found small lump breast diagnos stage iii breast cancer went home day differ woman say rememb moment breast cancer first touch life,1,,,,
45,,young still begin career regist nurs focus way better patient last thing mind think cancer quick chang march th receiv news year old want hear invas breast cancer read elizabeth jone stori http sgk mn etcbey https www komen org share stori elizabeth jone,1,,,,
46,,month ident twin sister diagnos diagnos breast cancer found staci breast cancer thought worst day life hear breast cancer well even wors shes still go treatment go treatment suppos get togeth patient traci edward breast cancer survivor stori http sgk mn qqr https ww komen org breast cancer stori traci edward html,1,,,,
47,,never late celebr beauti debbi last day chemo let show love komen support communiti,1,,,,
48,,today nation nurs day wed like thank nurs work tireless make differ live patient breastcanc,0,,,,
49,,januari went annual mammogram call back mammogram sent biopsi surgeri left breast result call back offic ask sit tabl specialist sit told worst word cancer tina krout breast cancer survivor http sgk mn dt r x https ww komen org breast cancer stori tina krout html went mind heard word tell us comment,1,,,,
50,,tripl negat breast cancer battl right maintain posit spirit wonder angel fight im happi count lot peopl support emot physic mental process warrior survivor woman mother fight togeth say survivor beatriz moreno learn tripl negat breast cancer http sgk mn hhwa https www komen org breast cancer diagnosi tripl negat,1,,,,
51,,help save live today breastcanc,0,,,,
52,,want end breast cancer fill blank motivationalmonday,0,,,,
53,,beauti mother pregnant fight breast cancer time epitom strength http bit ly srnuve https nbc com news local pregnant mother battl rare form breast cancer im gonna fight beat it,1,,,,
54,,mother continu inspir work advoc survivor proud abil redirect fear diagnosi help mani other madelin long gill breast cancer survivor join mother day movement use photo filter donat komen buy mother day gift today http sgk mn furqu everymom,1,,,,
55,,catriona origin diagnos stage tripl negat invas ducal carcinoma near year later diagnos stage metastat breast cancer age determin keep fight uplift women along way read stori http bit ly jap s,1,,,,
56,,mani much fill blank tell us strong,0,,,,
57,,break news komen scholar dr barzilay colleagu use artifici intellig better predict onset breast cancer use mammogram imag model predict someon like develop breast cancer year advanc read medic advanc https bit ly vgkuix https venturebeat com mit csail ai predict onset breast cancer year advanc,0,,,,
58,,wow word mani emot captur raw beauti photo inspir your alon,1,,,,
59,,women diagnos breast cancer lifetim inspir behind give donat fight tell us https ww komen org youron,0,,,,
60,,million breast cancer survivor u inspir us motivationalmonday,0,,,,
61,,new motto hair care co creator mom denis albert share head shave moment us thank denis brave open share journey inspir mani http bit ly w ou https www goodhousekeep com health shave hair chemo,1,,,,
62,,monica mcmillan diagnos breast cancer decemb strong woman maintain posit attitud lumpectomi chemo radiat bless amaz support system famili friend cowork church famili plus amaz duke team import god monica monica inspir,1,,,,
63,,taylor sadden hear famili go stand taylor swift,1,,,,
64,,year old michell diagnos metastat breast cancer lung brain kid faith help keep head everi day read stori http sgk mn xcmk v kept strong fight breast cancer,1,,,,
65,,mani breast cancer survivor want spread love nation cancer survivor day throughout june think power way handwritten note easi make donat send us letter strength handwrit deliv survivor need http bit ly lettersofstrength https hello pledgel com letter strength ncsd lettersofstrength,0,,,,
66,,let give shoutout beauti time breast cancer survivor th birthday women like continu work everi day end breast cancer forev,1,,,,
67,,first diagnos breast cancer brain start think kind thought like enter anoth dimens moment noth make sens cindi lawler breast cancer survivor went mind first diagnos,1,,,,
68,,although diagnosi come signific challeng pain loss chang qualiti life come gratitud increas strength harden determin renew purpos say celest hall live metastat breast cancer unit support fight breast cancer givingtuesday partner bank america quadrupl donat give today,1,,,,
69,,your strong dont forget gerri willi your thought begin treatment http fxn ws rf ls https www foxnew com opinion gerri willi breast cancer html,1,,,,
70,,tina diagnos breast cancer januari month husband diagnos stage iv brain cancer immedi thought son strong fight surviv hardest month life know lot stronger person life fragil forget live laugh love tina krout breast cancer survivor http sgk mn qft https www komen org share stori tina krout,1,,,,
71,,good time bad girlfriend alway peopl turn honor nationalgirlfriendsday join us thank girl us need want hear girl mean you,0,,,,
72,,year ago day mother day ali law diagnos breast cancer year old throughout chemo treatment overal journey experienc overwhelm love support famili friend let give shoutout mother rock join mother day movement use photo filter donat komen http sgk mn furqu everymom,1,,,,
73,,well august cell phone ring doctor phone say bernic sorri breast cancer invas ductil carcinoma stage tripl negat lost feel bodi couldnt move couldnt speak realli happen bernic caper breast cancer survivor http sgk mn dvxi f https ww komen org breast cancer stori bernic caper html rememb moment receiv diagnosi,1,,,,
74,,talk motivationalmonday love mom son duo danc help fundrais komen,0,,,,
75,,well august cell phone ring doctor phone say bernic sorri breast cancer invas ductil carcinoma stage tripl negat lost feel bodi couldnt move couldnt speak realli happen bernic caper breast cancer survivor http sgk mn dvxi f react diagnos drop us line below,1,,,,
76,,first diagnos breast cancer brain start think kind thought like enter anoth dimens moment noth make sens cindi lawler breast cancer survivor share us went mind first diagnos,1,,,,
77,,incred sadden news offer heartfelt condol support john entir famili tri time lose love breast cancer togeth continu fight find cure today show,1,,,,
78,,breast cancer hair hip world hand knew need posit ami keaton breast cancer survivor read ami breast cancer journey shes remain optimist http sgk mn nh,1,,,,
79,,togeth http sgk mn c e xm morethanpink,0,,,,
80,,u metastat breast cancer kill peopl year alon commit chang unaccept realiti launch susan g komen metastat breast cancer fund donat benefit metastat breast cancer communiti time end diseas join us http bit ly p,0,,,,
81,,breast cancer care care young old rich poor care color skin even male femal certain care pregnant carla time san diego susan g komen day walker read carla incred stori fight breast cancer pregnant http day co m,1,,,,
82,,month ago share stori inspir year old breast cancer survivor happi report remiss let wish lifetim health strength happi,1,,,,
83,,rest peac friend legendari coki robert famili friend heart https abcn ws kenn u,1,,,,
84,,kathi bressler stranger breast cancer lose mom grandmoth terribl diseas fight tripl negat breast cancer end begin new journey say chang forev wors show support kathi everymom use photo filter donat komen buy mother day gift today http sgk mn furqu,1,,,,
85,,rememb clear day diagnos breast cancer famili vacat thought might good news stomach backflip answer doctor cut chase sorri lump malign cheryl kravitz breast cancer survivor http sgk mn avbu https blog komen org blog get need rememb moment diagnos tell us comment below,1,,,,
86,,young age learn precious life thank lesson cancer taught easi absolut still live anxieti cancer could still return sure someth alway live live oh gosh ever life precious rememb everybodi die everybodi live want live cheer year mani come let celebr brittani year cancerversari inspir,1,,,,
87,,monday jessica rang bell mark complet breast cancer treatment let celebr moment her,1,,,,
88,,today honor women men whose live cut far short metastat breast cancer rememb today drop pictur comment make donat name donat komen week fund metastat breast cancer research,0,,,,
89,,cancer chang cancer speed bump complet road block still tri figur navig around year later cancer chang signific breast cancer survivor becki steiner http sgk mn n uvx,0,,,,
90,,million survivor move us daili weve lost everyth power end breastcanc forev morethanpink give shout survivor life http sgk mn c e xm,0,,,,
91,,everi day becom littl like mom couldnt prouder definit owe strength mom brittani beitel breast cancer survivor mom impact life show support mom everymom use mother day photo filter donat komen buy mother day gift today http sgk mn furqu,1,,,,
92,,sister chemo buddi isnt everi day hear sister diagnos breast cancer anoth sister diagnos angiosarcoma week read sister face advers humor hope inspir articl http bit ly ke http www peopl com articl utah sister diagnos cancerxid socialflow facebook peoplemag,1,,,,
93,,woman live determin whether live worldcancerday learn empow underserv women proactiv knowledg communic health profession breast health http sgk mn bmdo l https ww komen org blog world cancer day,0,,,,
94,,januari pm rang bell final chemotherapi appoint chemo taken hair didnt take sens hope cancer free futur tell us moment felt hope ww komen org moment https www komen org share stori,1,,,,
95,,your alon never learn healthi way cope stress caus fear well support group type support http sgk mn j mez,0,,,,
96,,despit famili histori breast cancer amanda diagnos stage breast cancer year ago age even long journey treatment continu job high school counselor dedic much time breast cancer caus help survivor survivor like amanda inspir partner go smile morethanpink learn join komen amanda fight breast cancer http ww komen org go smile,1,,,,
97,,desini diagnos stage breast cancer year old diagnosi put paus start life go colleg quit work travel constant appoint mani procedur desini read http sgk mn l ghvq https www komen org share stori destini bleau,1,,,,
98,,diagnos stage iv metastat breast cancer shi th birthday fear would affect futur chanc famili learn live futur live starr coleman experi metastat diagnosi year old thriver like starr count us fund research new breast cancer treatment start fundrais help http bit ly tmum b https www facebook com susangkomen fundrais creat sourc nonprofit short url sourc data breferr sourc d,1,,,,
99,,diagnos stage iv breast cancer shi th birthday fear would affect futur chanc famili learn live futur live starr coleman live metastat breast cancer read power stori http sgk mn vmwctr,1,,,,
100,,young still begin career regist nurs focus way better patient last thing mind think cancer quick chang march receiv news year old want hear elizabeth jone read elizbeth stori http sgk mn etcbey https ww komen org breast cancer stori elizabeth jone html,1,,,,
101,,year old mother year old daughter diagnos breast cancer month apart read stori hope support despit unbeliev odd cheer bethani mybritt http dailym ai kdahoi http www dailymail co uk femail articl mother daughter diagnos breast cancer time html motivationalmonday,1,,,,
102,,amanda month pregnant diagnos breast cancer couldnt accept possibl might around see daughter grow go amanda experienc today donat make x impact diseas donat becom donat end breast cancer forev,1,,,,
103,,today almost year cancer free deepli grate everi sunris becam mentor support person newli diagnos patient awar today ever incred lucki jennif slade hammond love jennif cancer diagnosi push becom charit person mani way breast cancer patient survivor get involv komen learn https ww komen org,1,,,,
104,,everi day gift fill blank let us know your celebr today motivationalmonday,0,,,,
105,,fill blank,0,,,,
106,,month ident twin sister diagnos diagnos breast cancer found staci breast cancer thought worst day life hear breast cancer well even wors shes still go treatment go treatment suppos get togeth patient traci edward breast cancer survivor stori http sgk mn qqr,1,,,,
107,,breast cancer life chang experi often alter peopl mindset belief fill blank tell us learn breast cancer journey motivationalmonday,0,,,,
108,,fill blank tell us give strength whether fight breast cancer help someon journey,0,,,,
109,,heart break lose carri corey longtim komen friend breast cancer tomorrow would carri th birthday carri beauti spirit legaci live forev rest peac http bit ly vgarmj,1,,,,
110,,komen communiti let send word encourag martha start round day chemo,1,,,,
111,,congrat giuliana rancic hit mileston year cancer free posit outlook desir help other inspir mani http today com ibgftb http www today com health giuliana rancic celebr year cancer free t,1,,,,
112,,unfortun betsey johnson know first hand import stay top breast health shes celebr year breast cancer free celebr cancerversari galentin day betsey susan g komen encourag talk best girl breast cancer women u diagnos breast cancer lifetim let reduc risk,1,,,,
113,,beauti talent young woman whose life cut far short stage iv breast cancer relentless desire famili sorri loss difficult time,1,,,,
114,,that someth celebr share post facebook friend tell us breast cancer stori http sgk mn qcfclm https www komen org submit stori,0,,,,
115,,work everi day die breast cancer let celebr survivor fought current fight diseas updat profil pictur frame million breast cancer survivor u s,0,,,,
116,,today everi day honor doctor made differ live women men affect breast cancer thank tireless effort help us put end breast cancer forev nationaldoctorsday,0,,,,
117,,seen previous post time breast cancer survivor ashle hunt news start famili alway dream hunt breast cancer interf plan overcom much heartbreak along journey child ashle husband surrog deliv perfect healthi beauti babi boy yesterday join us komen send warm congratul new famili read ashle nathan road pregnanc http bit ly htbdat,1,,,,
118,,ami keaton year old icu nurs found small lump breast diagnos advanc stage iii breast cancer went home day differ woman say rememb moment breast cancer first touch life,1,,,,
119,,educ specif aggress subtyp breast cancer http sgk mn b uylw,0,,,,
120,,realli well good day bad day cri get angri thank god reli support system rest exercis treat sweet hard impact everi aspect life famili friend live back fight say cinda paynter live metastat breast cancer fight for,1,,,,
121,,heather receiv unaccept metastat breast cancer diagnosi cancer spread breast lymph node femur hip brain spine husband kid biggest support motiv fight hard breast cancer fight open eye enjoy life famili love one take thing life serious live everi day gift advic everyon go fight never give tri remain posit possibl heather rister http sgk mn zebzaw unaccept,1,,,,
122,,terribl diseas caus million peopl blood sweat mani tear unaccept fill blank tell us think breast cancer unaccept,0,,,,
123,,turn year old juli never envis would enter breast cancer live normal life day day activ take care half year old dog hous enjoy thing stay home mom march hit knew noth would rachel boos breast cancer survivor http sgk mn ttdmnd,1,,,,
124,,mani ask question suggest healthi women averag breast cancer risk sign breast cancer delay annual mammogram schedul spring recommend intend minim exposur potenti spread covid import women men know normal contact doctor someth chang warn sign awar http sgk mn deorju https blog komen org blog delay mammogram covid mean women must know normal warn sign,0,,,,
125,,whether youv diagnos breast cancer survivor love whos face terribl diseas stori want hear drop us line below,0,,,,
126,,celebr morethanpink hero communiti live support us love us fundrais done someth beyond help end breast cancer mayb hero man woman life current fight breast cancer want honor morethanpink hero hero life custom profil pictur filter,0,,,,
127,,reason feel anyth joy teach yoga class week work communic client maryland around countri giddili contempl th row ticket see roll stone arizona later summer year physic test came back perfect left mammogram cheryl kravitz breast cancer survivor unfortun cheryl mammogram clear breast cancer http sgk mn fwben https ww komen org breast cancer stori cheryl kravitz html blindsid breast cancer diagnosi tell us stori comment below,1,,,,
